Sheet: log
A1: 20160905
A2: sima
A3: 表创建
D7: 卡牌（卡牌原画和卡牌ID相同） | E7: 普通卡牌 | F7: 1000 | G7: 1999 | I7: 卡牌表 | J7: 1000
E8: 技能卡牌 | F8: 2000 | G8: 2999 | J8: 1000
E9: 普通闪卡 | F9: 3000 | G9: 3999 | J9: 1000
E10: 技能闪卡 | F10: 4000 | G10: 4999 | J10: 1000
C15: f | D15: 火 | E15: 0 | H15: Contry
C16: i | D16: 冰 | E16: 1
C17: e | D17: 电 | E17: 2
C18: s | D18: 日 | E18: 3
C19: m | D19: 月 | E19: 4

Sheet: 全卡牌列表
A1: 卡牌列表V2.0
A2: int | B2: string | C2: int | D2: int | E2: int | F2: int | G2: int | H2: int | I2: int | J2: int | K2: string | L2: string
A3: Id | B3: Name | C3: Rare | D3: Up | E3: Left | F3: Down | G3: Right | H3: Sum | I3: Contry | J3: Skillid | K3: Coin | L3: Describe
A4: 1000 | B4: 米诺斯战士（牛头怪） | C4: 2 | D4: 4 | E4: 4 | F4: 3 | G4: 2 | H4: 13 | I4: 1 | J4: 12000 | K4: 66:20 | L4: 王国的战士，混沌、邪恶、力量和杀戮的象征；
A5: 1001 | B5: 美杜莎 | C5: 2 | D5: 7 | E5: 2 | F5: 2 | G5: 2 | H5: 13 | I5: 1 | J5: 12000 | K5: 66:20 | L5: 因美丽遭到神明诅咒的雅典娜神庙的普通女祭司，也有传闻她的父亲是海神福耳库斯
A6: 1002 | B6: 九头蛇 | C6: 2 | D6: 5 | E6: 2 | F6: 5 | G6: 2 | H6: 14 | I6: 1 | J6: 12000 | K6: 66:20 | L6: 传说它拥有九颗头，其中一颗头要是被斩断，立刻又会生出两颗头来，真是让人头疼的怪物
A7: 1003 | B7: 半人马 | C7: 2 | D7: 2 | E7: 5 | F7: 2 | G7: 5 | H7: 14 | I7: 1 | J7: 12000 | K7: 66:20 | L7: 希腊人总认为游牧民族都是半人马，但是真相谁知道呢
A8: 1004 | B8: 独眼巨人 | C8: 2 | D8: 4 | E8: 3 | F8: 3 | G8: 5 | H8: 15 | I8: 1 | J8: 12000 | K8: 66:20 | L8: 西里岛的原住民，它们强壮、固执、并且感情冲动，很会制造和使用各种工具和武器
A9: 1005 | B9: 冰霜巨人 | C9: 2 | D9: 2 | E9: 7 | F9: 2 | G9: 2 | H9: 13 | I9: 2 | J9: 12000 | K9: 66:20 | L9: 在约顿海姆生活的蓝色巨人，他们只是热情，并不好战，当然这也是他们自己说的
A10: 1006 | B10: 女武神 | C10: 2 | D10: 1 | E10: 1 | F10: 7 | G10: 4 | H10: 13 | I10: 2 | J10: 12000 | K10: 66:20 | L10: 牵引着灵魂的低阶神明，但是谁知道你会被带到哪儿？
A11: 1007 | B11: 圣灵 | C11: 2 | D11: 5 | E11: 5 | F11: 2 | G11: 2 | H11: 14 | I11: 2 | J11: 12000 | K11: 66:20 | L11: 守护着世界树的圣灵们，他们最擅长的就是点着你或者把你变成冰块
A12: 1008 | B12: 亚尔夫海姆精灵 | C12: 2 | D12: 2 | E12: 2 | F12: 5 | G12: 5 | H12: 14 | I12: 2 | J12: 12000 | K12: 66:20 | L12: “平时看他们种种花草，没想到却会使用这么强大的法术”--托尔
A13: 1009 | B13: 瓦特阿尔海姆侏儒 | C13: 2 | D13: 2 | E13: 4 | F13: 5 | G13: 4 | H13: 15 | I13: 2 | J13: 12000 | K13: 66:20 | L13: 侏儒们都是厉害的巧匠，拥有种种神秘的力量和深遂的知识，他们为神明打造出很多宝物，比如闪电。
A14: 1010 | B14: 格里芬 | C14: 2 | D14: 3 | E14: 1 | F14: 2 | G14: 7 | H14: 13 | I14: 3 | J14: 12000 | K14: 66:20 | L14: 格里芬长有狮子的躯体与利爪、鹰的头和翅膀，是相当有名的生物
A15: 1011 | B15: 圣甲虫 | C15: 2 | D15: 1 | E15: 1 | F15: 7 | G15: 4 | H15: 13 | I15: 3 | J15: 12000 | K15: 66:20 | L15: 人们将圣甲虫作为图腾之物，当法老死去时，他的心脏就会被切出来，换上一块缀满圣甲虫的石头。
A16: 1012 | B16: 木乃伊 | C16: 2 | D16: 5 | E16: 2 | F16: 2 | G16: 5 | H16: 14 | I16: 3 | J16: 12000 | K16: 66:20 | L16: 请注意保持对逝者的敬意
A17: 1013 | B17: 蝎子人 | C17: 2 | D17: 2 | E17: 5 | F17: 5 | G17: 2 | H17: 14 | I17: 3 | J17: 12000 | K17: 66:20 | L17: 蝎头人神的怪物，据说当人们死亡的时候，灵魂进入审判堂的时候，他们会趁机偷走遗体
A18: 1014 | B18: 胡狼人 | C18: 2 | D18: 3 | E18: 4 | F18: 5 | G18: 3 | H18: 15 | I18: 3 | J18: 12000 | K18: 66:20 | L18: 法老王的忠实的仆从们，它们永远守护着法老王的遗体
A19: 1015 | B19: 盖亚 | C19: 3 | D19: 3 | E19: 2 | F19: 7 | G19: 6 | H19: 18 | I19: 1 | J19: 12000 | K19: 66:50 | L19: 希腊神话中的大地之神，是众神之母，所有神灵中德高望重的显赫之神
A20: 1016 | B20: 赫卡忒 | C20: 3 | D20: 2 | E20: 7 | F20: 6 | G20: 3 | H20: 18 | I20: 1 | J20: 12000 | K20: 66:50 | L20: 赫卡忒总是和月光、夜晚、鬼魂、地狱、精灵、魔法、巫术和妖术联系在一起。之后她曾经帮助宙斯打败过独眼巨人，所以她有着巨人一般的强大力量，即使是宙斯也要畏惧她三分
A21: 1017 | B21: 瑞亚 | C21: 3 | D21: 6 | E21: 3 | F21: 7 | G21: 3 | H21: 19 | I21: 1 | J21: 12000 | K21: 66:50 | L21: 瑞亚有6个孩子：赫斯提亚、德墨忒尔，赫拉，哈得斯，波塞冬和......宙斯
A22: 1018 | B22: 墨提斯 | C22: 3 | D22: 3 | E22: 6 | F22: 3 | G22: 7 | H22: 19 | I22: 1 | J22: 12000 | K22: 66:50 | L22: 诞生了雅典娜，墨提斯就成为宙斯的思想和意志
A23: 1019 | B23: 普罗米修斯 | C23: 3 | D23: 5 | E23: 5 | F23: 5 | G23: 5 | H23: 20 | I23: 1 | J23: 12000 | K23: 66:50 | L23: 盗火者普罗米修斯，他制造了所有的男人，偷了天火，给予人们作为生存下去的必需品...
A24: 1020 | B24: 提尔 | C24: 3 | D24: 6 | E24: 3 | F24: 2 | G24: 7 | H24: 18 | I24: 2 | J24: 12000 | K24: 66:50 | L24: 只有一只手的战神，他所向披靡，象征着荣耀
A25: 1021 | B25: 洛基 | C25: 3 | D25: 7 | E25: 6 | F25: 2 | G25: 3 | H25: 18 | I25: 2 | J25: 12000 | K25: 66:50 | L25: 洛基本身是灶火的人格化，火能造福也能为祸
A26: 1022 | B26: 海姆达尔 | C26: 3 | D26: 4 | E26: 5 | F26: 5 | G26: 5 | H26: 19 | I26: 2 | J26: 12000 | K26: 66:50 | L26: 海姆达尔是神殿的守护者；传说中，人类的三个阶级是海姆达尔创出来的（奴隶，农民，贵族）。他曾化名为里格，并在三个家庭中住宿。
A27: 1023 | B27: 瓦尔基莉亚 | C27: 3 | D27: 5 | E27: 5 | F27: 4 | G27: 5 | H27: 19 | I27: 2 | J27: 12000 | K27: 66:50 | L27: “身披闪亮的战甲，骑着俊美白马的少女战士们，吹响号角，给英灵们带去蜂蜜酒吧！”--尼伯龙根的回响
A28: 1024 | B28: 诺恩斯/沃德/维尔丹妮 | C28: 3 | D28: 7 | E28: 3 | F28: 3 | G28: 7 | H28: 20 | I28: 2 | J28: 12000 | K28: 66:50 | L28: 你的命运因何而起，因何而终，我们并不关心，因为我们控制的不是你的命运而是时间
A29: 1025 | B29: 休 | C29: 3 | D29: 2 | E29: 7 | F29: 7 | G29: 2 | H29: 18 | I29: 3 | J29: 12000 | K29: 66:50 | L29: 古埃及的风神，为了避免天与大地相合，因此休神常常是站在自己的儿子身上，而他的双手则将女儿高高举起，将他们分开。
A30: 1026 | B30: 泰芙努特 | C30: 3 | D30: 7 | E30: 2 | F30: 2 | G30: 7 | H30: 18 | I30: 3 | J30: 12000 | K30: 66:50 | L30: 控制雨水的神明，当埃及遭遇干旱时，他们就会办成狒狒的样子，让泰芙努特开心，然后亲盆大雨就瓢泼而至了
A31: 1027 | B31: 荷鲁斯 | C31: 3 | D31: 10 | E31: 3 | F31: 3 | G31: 3 | H31: 19 | I31: 3 | J31: 12000 | K31: 66:50 | L31: 荷鲁斯的眼睛代表的是太阳与月亮，当他没有眼睛的时候，他会不分敌我
A32: 1028 | B32: 凯布利 | C32: 3 | D32: 4 | E32: 5 | F32: 6 | G32: 4 | H32: 19 | I32: 3 | J32: 12000 | K32: 66:50 | L32: 圣甲虫的神，凯布利经常代替神明指导人类的王应该如何统治与支配
A33: 1029 | B33: 贝斯帝 | C33: 3 | D33: 6 | E33: 2 | F33: 6 | G33: 6 | H33: 20 | I33: 3 | J33: 12000 | K33: 66:50 | L33: “忠诚？我不过是为了自己的种族罢了，凡人”
A34: 1030 | B34: 尤拉诺斯 | C34: 4 | D34: 7 | E34: 2 | F34: 4 | G34: 8 | H34: 21 | I34: 1 | J34: 12000 | K34: 66:200 | L34: 象征着天空的神明，但却遭到了儿子的叛变而陨落，所以他也诅咒自己的儿子会和自己拥有相同的因果
A35: 1031 | B35: 尼莫西妮 | C35: 4 | D35: 7 | E35: 1 | F35: 7 | G35: 7 | H35: 22 | I35: 1 | J35: 12000 | K35: 66:200 | L35: 代表记忆的泰坦神，她是文艺之神缪斯之母，也许她偶尔也会创作一些好作品
A36: 1032 | B36: 考伊斯 | C36: 4 | D36: 5 | E36: 6 | F36: 6 | G36: 6 | H36: 23 | I36: 1 | J36: 12000 | K36: 66:200 | L36: 也许我的孩子们比我更需要我的宝物也说不定
A37: 1033 | B37: 托尔 | C37: 4 | D37: 8 | E37: 5 | F37: 7 | G37: 3 | H37: 23 | I37: 2 | J37: 12000 | K37: 66:200 | L37: “我们惧怕闪电是因为害怕之后到达的人，可拍的姆乔尔尼尔”--某位巨人
A38: 1034 | B38: 霍杜尔 | C38: 4 | D38: 3 | E38: 8 | F38: 3 | G38: 8 | H38: 22 | I38: 2 | J38: 12000 | K38: 66:200 | L38: 我的兄弟，巴尔德唷，黑暗与光明永远都是敌人；霍杜尔天生失明，并且成为了黑暗之神，并在洛基的帮助下杀死了巴尔德
A39: 1035 | B39: 巴尔德 | C39: 4 | D39: 8 | E39: 3 | F39: 8 | G39: 3 | H39: 22 | I39: 2 | J39: 12000 | K39: 66:200 | L39: 巴尔德才貌出众,满面春风。当他微笑的时候，人们都感到无比喜悦。作为光明之神再恰当不过了。
A40: 1036 | B40: 奥西里斯 | C40: 4 | D40: 6 | E40: 6 | F40: 5 | G40: 6 | H40: 23 | I40: 3 | J40: 12000 | K40: 66:200 | L40: 奥西里斯是文明的给予者，冥界的审判者，他来审判一切死亡后的人是否能永生
A41: 1037 | B41: 马特 | C41: 4 | D41: 8 | E41: 3 | F41: 3 | G41: 7 | H41: 21 | I41: 3 | J41: 12000 | K41: 66:200 | L41: 司掌战争的女神，她也是月神的女儿，人们公认的正义的象征，阿努比斯则用它身上的羽毛作为衡量人心是否善良的筹码
A42: 1038 | B42: 阿努比斯 | C42: 4 | D42: 1 | E42: 8 | F42: 8 | G42: 4 | H42: 21 | I42: 3 | J42: 12000 | K42: 66:200 | L42: 在亡者神殿用天秤决定每个灵魂是上天堂还是下地狱，阿努比斯是奥西里斯的儿子，不过形态却永久处于光明与黑暗之间
A43: 2000 | B43: 克罗诺斯 | C43: 5 | D43: 5 | E43: 9 | F43: 6 | G43: 9 | H43: 29 | I43: 1 | J43: 12001 | K43: 66:500 | L43: 克洛诺斯推翻了他父亲尤拉诺斯的残暴统治后，领导了希腊神话中的黄金时代，直到他被他自己的儿子宙斯推翻
A44: 2001 | B44: 克瑞斯 | C44: 5 | D44: 1 | E44: 8 | F44: 10 | G44: 8 | H44: 27 | I44: 1 | J44: 12002 | K44: 66:500 | L44: “你帮助了我找到女儿，你需要点石成金的法术吗？我可以把他祝福在你的手上！”--迈达斯王的回忆
A45: 2002 | B45: 奥丁 | C45: 5 | D45: 4 | E45: 9 | F45: 9 | G45: 7 | H45: 29 | I45: 2 | J45: 12003 | K45: 66:500 | L45: 北欧神话中的至高神，阿萨神族的神王，天空的人格化，世界的统治者，被称为诸神之父，司掌战争、权力、智慧、魔法和死亡。
A46: 2003 | B46: 赫尔 | C46: 5 | D46: 10 | E46: 1 | F46: 10 | G46: 5 | H46: 26 | I46: 2 | J46: 12004 | K46: 66:500 | L46: 赫尔的脸一边如神一般温和美丽，而另一边是恶鬼般腐烂狰狞，她的侍者是愚钝，仆从是迟缓，她正式地狱的死神，尼弗海姆的神王
A47: 2004 | B47: 拉 | C47: 5 | D47: 7 | E47: 7 | F47: 7 | G47: 7 | H47: 28 | I47: 3 | J47: 12005 | K47: 66:500 | L47: 古埃及中拥有绝对权威的太阳神，他高于一切，永远享受着人们的信仰
A48: 2005 | B48: 阿蒙 | C48: 5 | D48: 8 | E48: 8 | F48: 1 | G48: 10 | H48: 27 | I48: 3 | J48: 12006 | K48: 66:500 | L48: 古代神明的人类代表，阿蒙等同于拉，不同的是，他是以英俊而威严出现，而拉则是以年迈的老人出现
A49: 3000 | B49: 米诺斯战士（牛头怪） | C49: 2 | D49: 4 | E49: 4 | F49: 3 | G49: 2 | H49: 13 | I49: 1 | J49: 12000 | K49: 66:50 | L49: 王国的战士，混沌、邪恶、力量和杀戮的象征；
A50: 3001 | B50: 美杜莎 | C50: 2 | D50: 7 | E50: 2 | F50: 2 | G50: 2 | H50: 13 | I50: 1 | J50: 12000 | K50: 66:50 | L50: 因美丽遭到神明诅咒的雅典娜神庙的普通女祭司，也有传闻她的父亲是海神福耳库斯
A51: 3002 | B51: 九头蛇 | C51: 2 | D51: 5 | E51: 2 | F51: 5 | G51: 2 | H51: 14 | I51: 1 | J51: 12000 | K51: 66:50 | L51: 传说它拥有九颗头，其中一颗头要是被斩断，立刻又会生出两颗头来，真是让人头疼的怪物
A52: 3003 | B52: 半人马 | C52: 2 | D52: 2 | E52: 5 | F52: 2 | G52: 5 | H52: 14 | I52: 1 | J52: 12000 | K52: 66:50 | L52: 希腊人总认为游牧民族都是半人马，但是真相谁知道呢
A53: 3004 | B53: 独眼巨人 | C53: 2 | D53: 4 | E53: 3 | F53: 3 | G53: 5 | H53: 15 | I53: 1 | J53: 12000 | K53: 66:50 | L53: 西里岛的原住民，它们强壮、固执、并且感情冲动，很会制造和使用各种工具和武器
A54: 3005 | B54: 冰霜巨人 | C54: 2 | D54: 2 | E54: 7 | F54: 2 | G54: 2 | H54: 13 | I54: 2 | J54: 12000 | K54: 66:50 | L54: 在约顿海姆生活的蓝色巨人，他们只是热情，并不好战，当然这也是他们自己说的
A55: 3006 | B55: 女武神 | C55: 2 | D55: 1 | E55: 1 | F55: 7 | G55: 4 | H55: 13 | I55: 2 | J55: 12000 | K55: 66:50 | L55: 牵引着灵魂的低阶神明，但是谁知道你会被带到哪儿？
A56: 3007 | B56: 圣灵 | C56: 2 | D56: 5 | E56: 5 | F56: 2 | G56: 2 | H56: 14 | I56: 2 | J56: 12000 | K56: 66:50 | L56: 守护着世界树的圣灵们，他们最擅长的就是点着你或者把你变成冰块
A57: 3008 | B57: 亚尔夫海姆精灵 | C57: 2 | D57: 2 | E57: 2 | F57: 5 | G57: 5 | H57: 14 | I57: 2 | J57: 12000 | K57: 66:50 | L57: “平时看他们种种花草，没想到却会使用这么强大的法术”--托尔
A58: 3009 | B58: 瓦特阿尔海姆侏儒 | C58: 2 | D58: 2 | E58: 4 | F58: 5 | G58: 4 | H58: 15 | I58: 2 | J58: 12000 | K58: 66:50 | L58: 侏儒们都是厉害的巧匠，拥有种种神秘的力量和深遂的知识，他们为神明打造出很多宝物，比如闪电。
A59: 3010 | B59: 格里芬 | C59: 2 | D59: 3 | E59: 1 | F59: 2 | G59: 7 | H59: 13 | I59: 3 | J59: 12000 | K59: 66:50 | L59: 格里芬长有狮子的躯体与利爪、鹰的头和翅膀，是相当有名的生物
A60: 3011 | B60: 圣甲虫 | C60: 2 | D60: 1 | E60: 1 | F60: 7 | G60: 4 | H60: 13 | I60: 3 | J60: 12000 | K60: 66:50 | L60: 人们将圣甲虫作为图腾之物，当法老死去时，他的心脏就会被切出来，换上一块缀满圣甲虫的石头。
A61: 3012 | B61: 木乃伊 | C61: 2 | D61: 5 | E61: 2 | F61: 2 | G61: 5 | H61: 14 | I61: 3 | J61: 12000 | K61: 66:50 | L61: 请注意保持对逝者的敬意
A62: 3013 | B62: 蝎子人 | C62: 2 | D62: 2 | E62: 5 | F62: 5 | G62: 2 | H62: 14 | I62: 3 | J62: 12000 | K62: 66:50 | L62: 蝎头人神的怪物，据说当人们死亡的时候，灵魂进入审判堂的时候，他们会趁机偷走遗体
A63: 3014 | B63: 胡狼人 | C63: 2 | D63: 3 | E63: 4 | F63: 5 | G63: 3 | H63: 15 | I63: 3 | J63: 12000 | K63: 66:50 | L63: 法老王的忠实的仆从们，它们永远守护着法老王的遗体
A64: 3015 | B64: 盖亚 | C64: 3 | D64: 3 | E64: 2 | F64: 7 | G64: 6 | H64: 18 | I64: 1 | J64: 12000 | K64: 66:200 | L64: 希腊神话中的大地之神，是众神之母，所有神灵中德高望重的显赫之神
A65: 3016 | B65: 赫卡忒 | C65: 3 | D65: 2 | E65: 7 | F65: 6 | G65: 3 | H65: 18 | I65: 1 | J65: 12000 | K65: 66:200 | L65: 赫卡忒总是和月光、夜晚、鬼魂、地狱、精灵、魔法、巫术和妖术联系在一起。之后她曾经帮助宙斯打败过独眼巨人，所以她有着巨人一般的强大力量，即使是宙斯也要畏惧她三分
A66: 3017 | B66: 瑞亚 | C66: 3 | D66: 6 | E66: 3 | F66: 7 | G66: 3 | H66: 19 | I66: 1 | J66: 12000 | K66: 66:200 | L66: 瑞亚有6个孩子：赫斯提亚、德墨忒尔，赫拉，哈得斯，波塞冬和......宙斯
A67: 3018 | B67: 墨提斯 | C67: 3 | D67: 3 | E67: 6 | F67: 3 | G67: 7 | H67: 19 | I67: 1 | J67: 12000 | K67: 66:200 | L67: 诞生了雅典娜，墨提斯就成为宙斯的思想和意志
A68: 3019 | B68: 普罗米修斯 | C68: 3 | D68: 5 | E68: 5 | F68: 5 | G68: 5 | H68: 20 | I68: 1 | J68: 12000 | K68: 66:200 | L68: 盗火者普罗米修斯，他制造了所有的男人，偷了天火，给予人们作为生存下去的必需品...
A69: 3020 | B69: 提尔 | C69: 3 | D69: 6 | E69: 3 | F69: 2 | G69: 7 | H69: 18 | I69: 2 | J69: 12000 | K69: 66:200 | L69: 只有一只手的战神，他所向披靡，象征着荣耀
A70: 3021 | B70: 洛基 | C70: 3 | D70: 7 | E70: 6 | F70: 2 | G70: 3 | H70: 18 | I70: 2 | J70: 12000 | K70: 66:200 | L70: 洛基本身是灶火的人格化，火能造福也能为祸
A71: 3022 | B71: 海姆达尔 | C71: 3 | D71: 4 | E71: 5 | F71: 5 | G71: 5 | H71: 19 | I71: 2 | J71: 12000 | K71: 66:200 | L71: 海姆达尔是神殿的守护者；传说中，人类的三个阶级是海姆达尔创出来的（奴隶，农民，贵族）。他曾化名为里格，并在三个家庭中住宿。
A72: 3023 | B72: 瓦尔基莉亚 | C72: 3 | D72: 5 | E72: 5 | F72: 4 | G72: 5 | H72: 19 | I72: 2 | J72: 12000 | K72: 66:200 | L72: “身披闪亮的战甲，骑着俊美白马的少女战士们，吹响号角，给英灵们带去蜂蜜酒吧！”--尼伯龙根的回响
A73: 3024 | B73: 诺恩斯/沃德/维尔丹妮 | C73: 3 | D73: 7 | E73: 3 | F73: 3 | G73: 7 | H73: 20 | I73: 2 | J73: 12000 | K73: 66:200 | L73: 你的命运因何而起，因何而终，我们并不关心，因为我们控制的不是你的命运而是时间
A74: 3025 | B74: 休 | C74: 3 | D74: 2 | E74: 7 | F74: 7 | G74: 2 | H74: 18 | I74: 3 | J74: 12000 | K74: 66:200 | L74: 古埃及的风神，为了避免天与大地相合，因此休神常常是站在自己的儿子身上，而他的双手则将女儿高高举起，将他们分开。
A75: 3026 | B75: 泰芙努特 | C75: 3 | D75: 7 | E75: 2 | F75: 2 | G75: 7 | H75: 18 | I75: 3 | J75: 12000 | K75: 66:200 | L75: 控制雨水的神明，当埃及遭遇干旱时，他们就会办成狒狒的样子，让泰芙努特开心，然后亲盆大雨就瓢泼而至了
A76: 3027 | B76: 荷鲁斯 | C76: 3 | D76: 10 | E76: 3 | F76: 3 | G76: 3 | H76: 19 | I76: 3 | J76: 12000 | K76: 66:200 | L76: 荷鲁斯的眼睛代表的是太阳与月亮，当他没有眼睛的时候，他会不分敌我
A77: 3028 | B77: 凯布利 | C77: 3 | D77: 4 | E77: 5 | F77: 6 | G77: 4 | H77: 19 | I77: 3 | J77: 12000 | K77: 66:200 | L77: 圣甲虫的神，凯布利经常代替神明指导人类的王应该如何统治与支配
A78: 3029 | B78: 贝斯帝 | C78: 3 | D78: 6 | E78: 2 | F78: 6 | G78: 6 | H78: 20 | I78: 3 | J78: 12000 | K78: 66:200 | L78: “忠诚？我不过是为了自己的种族罢了，凡人”
A79: 3030 | B79: 尤拉诺斯 | C79: 4 | D79: 7 | E79: 2 | F79: 4 | G79: 8 | H79: 21 | I79: 1 | J79: 12000 | K79: 66:500 | L79: 象征着天空的神明，但却遭到了儿子的叛变而陨落，所以他也诅咒自己的儿子会和自己拥有相同的因果
A80: 3031 | B80: 尼莫西妮 | C80: 4 | D80: 7 | E80: 1 | F80: 7 | G80: 7 | H80: 22 | I80: 1 | J80: 12000 | K80: 66:500 | L80: 代表记忆的泰坦神，她是文艺之神缪斯之母，也许她偶尔也会创作一些好作品
A81: 3032 | B81: 考伊斯 | C81: 4 | D81: 5 | E81: 6 | F81: 6 | G81: 6 | H81: 23 | I81: 1 | J81: 12000 | K81: 66:500 | L81: 也许我的孩子们比我更需要我的宝物也说不定
A82: 3033 | B82: 托尔 | C82: 4 | D82: 8 | E82: 5 | F82: 7 | G82: 3 | H82: 23 | I82: 2 | J82: 12000 | K82: 66:500 | L82: “我们惧怕闪电是因为害怕之后到达的人，可拍的姆乔尔尼尔”--某位巨人
A83: 3034 | B83: 霍杜尔 | C83: 4 | D83: 3 | E83: 8 | F83: 3 | G83: 8 | H83: 22 | I83: 2 | J83: 12000 | K83: 66:500 | L83: 我的兄弟，巴尔德唷，黑暗与光明永远都是敌人；霍杜尔天生失明，并且成为了黑暗之神，并在洛基的帮助下杀死了巴尔德
A84: 3035 | B84: 巴尔德 | C84: 4 | D84: 8 | E84: 3 | F84: 8 | G84: 3 | H84: 22 | I84: 2 | J84: 12000 | K84: 66:500 | L84: 巴尔德才貌出众,满面春风。当他微笑的时候，人们都感到无比喜悦。作为光明之神再恰当不过了。
A85: 3036 | B85: 奥西里斯 | C85: 4 | D85: 6 | E85: 6 | F85: 5 | G85: 6 | H85: 23 | I85: 3 | J85: 12000 | K85: 66:500 | L85: 奥西里斯是文明的给予者，冥界的审判者，他来审判一切死亡后的人是否能永生
A86: 3037 | B86: 马特 | C86: 4 | D86: 8 | E86: 3 | F86: 3 | G86: 7 | H86: 21 | I86: 3 | J86: 12000 | K86: 66:500 | L86: 司掌战争的女神，她也是月神的女儿，人们公认的正义的象征，阿努比斯则用它身上的羽毛作为衡量人心是否善良的筹码
A87: 3038 | B87: 阿努比斯 | C87: 4 | D87: 1 | E87: 8 | F87: 8 | G87: 4 | H87: 21 | I87: 3 | J87: 12000 | K87: 66:500 | L87: 在亡者神殿用天秤决定每个灵魂是上天堂还是下地狱，阿努比斯是奥西里斯的儿子，不过形态却永久处于光明与黑暗之间
A88: 4000 | B88: 克罗诺斯 | C88: 5 | D88: 5 | E88: 9 | F88: 6 | G88: 9 | H88: 29 | I88: 1 | J88: 12001 | K88: 66:1000 | L88: 克洛诺斯推翻了他父亲尤拉诺斯的残暴统治后，领导了希腊神话中的黄金时代，直到他被他自己的儿子宙斯推翻
A89: 4001 | B89: 克瑞斯 | C89: 5 | D89: 1 | E89: 8 | F89: 10 | G89: 8 | H89: 27 | I89: 1 | J89: 12002 | K89: 66:1000 | L89: “你帮助了我找到女儿，你需要点石成金的法术吗？我可以把他祝福在你的手上！”--迈达斯王的回忆
A90: 4002 | B90: 奥丁 | C90: 5 | D90: 4 | E90: 9 | F90: 9 | G90: 7 | H90: 29 | I90: 2 | J90: 12003 | K90: 66:1000 | L90: 北欧神话中的至高神，阿萨神族的神王，天空的人格化，世界的统治者，被称为诸神之父，司掌战争、权力、智慧、魔法和死亡。
A91: 4003 | B91: 赫尔 | C91: 5 | D91: 10 | E91: 1 | F91: 10 | G91: 5 | H91: 26 | I91: 2 | J91: 12004 | K91: 66:1000 | L91: 赫尔的脸一边如神一般温和美丽，而另一边是恶鬼般腐烂狰狞，她的侍者是愚钝，仆从是迟缓，她正式地狱的死神，尼弗海姆的神王
A92: 4004 | B92: 拉 | C92: 5 | D92: 7 | E92: 7 | F92: 7 | G92: 7 | H92: 28 | I92: 3 | J92: 12005 | K92: 66:1000 | L92: 古埃及中拥有绝对权威的太阳神，他高于一切，永远享受着人们的信仰
A93: 4005 | B93: 阿蒙 | C93: 5 | D93: 8 | E93: 8 | F93: 1 | G93: 10 | H93: 27 | I93: 3 | J93: 12006 | K93: 66:1000 | L93: 古代神明的人类代表，阿蒙等同于拉，不同的是，他是以英俊而威严出现，而拉则是以年迈的老人出现

Sheet: 策划用中文
A1: 卡牌列表V2.0
A2: ID | B2: 名称 | C2: 星级 | D2: 上维 | E2: 左维 | F2: 下维 | G2: 右维 | H2: 四维总和 | I2: 技能ID | J2: 是否可拆分 | K2: 拆分获得卡尘 | L2: 是否可合成 | M2: 合成需要卡尘 | N2: 背景故事（文字叙述）
A3: 1000 | B3: 米诺斯战士（牛头怪） | C3: 2 | D3: 4 | E3: 4 | F3: 3 | G3: 2 | H3: 13 | I3: 8000 | J3: 0 | K3: 0 | L3: 0 | M3: 0 | N3: 王国的战士，混沌、邪恶、力量和杀戮的象征；
A4: 1001 | B4: 美杜莎 | C4: 2 | D4: 7 | E4: 2 | F4: 2 | G4: 2 | H4: 13 | I4: 8000 | J4: 0 | K4: 0 | L4: 0 | M4: 0 | N4: 因美丽遭到神明诅咒的雅典娜神庙的普通女祭司，也有传闻她的父亲是海神福耳库斯
A5: 1002 | B5: 九头蛇 | C5: 2 | D5: 5 | E5: 2 | F5: 5 | G5: 2 | H5: 14 | I5: 8000 | J5: 0 | K5: 0 | L5: 0 | M5: 0 | N5: 传说它拥有九颗头，其中一颗头要是被斩断，立刻又会生出两颗头来，真是让人头疼的怪物
A6: 1003 | B6: 半人马 | C6: 2 | D6: 2 | E6: 5 | F6: 2 | G6: 5 | H6: 14 | I6: 8000 | J6: 0 | K6: 0 | L6: 0 | M6: 0 | N6: 希腊人总认为游牧民族都是半人马，但是真相谁知道呢
A7: 1004 | B7: 独眼巨人 | C7: 2 | D7: 4 | E7: 3 | F7: 3 | G7: 5 | H7: 15 | I7: 8000 | J7: 0 | K7: 0 | L7: 0 | M7: 0 | N7: 西里岛的原住民，它们强壮、固执、并且感情冲动，很会制造和使用各种工具和武器
A8: 1005 | B8: 冰霜巨人 | C8: 2 | D8: 2 | E8: 7 | F8: 2 | G8: 2 | H8: 13 | I8: 8000 | J8: 0 | K8: 0 | L8: 0 | M8: 0 | N8: 在约顿海姆生活的蓝色巨人，他们只是热情，并不好战，当然这也是他们自己说的
A9: 1006 | B9: 女武神 | C9: 2 | D9: 1 | E9: 1 | F9: 7 | G9: 4 | H9: 13 | I9: 8000 | J9: 0 | K9: 0 | L9: 0 | M9: 0 | N9: 牵引着灵魂的低阶神明，但是谁知道你会被带到哪儿？
A10: 1007 | B10: 圣灵 | C10: 2 | D10: 5 | E10: 5 | F10: 2 | G10: 2 | H10: 14 | I10: 8000 | J10: 0 | K10: 0 | L10: 0 | M10: 0 | N10: 守护着世界树的圣灵们，他们最擅长的就是点着你或者把你变成冰块
A11: 1008 | B11: 亚尔夫海姆精灵 | C11: 2 | D11: 2 | E11: 2 | F11: 5 | G11: 5 | H11: 14 | I11: 8000 | J11: 0 | K11: 0 | L11: 0 | M11: 0 | N11: “平时看他们种种花草，没想到却会使用这么强大的法术”--托尔
A12: 1009 | B12: 瓦特阿尔海姆侏儒 | C12: 2 | D12: 2 | E12: 4 | F12: 5 | G12: 4 | H12: 15 | I12: 8000 | J12: 0 | K12: 0 | L12: 0 | M12: 0 | N12: 侏儒们都是厉害的巧匠，拥有种种神秘的力量和深遂的知识，他们为神明打造出很多宝物，比如闪电。
A13: 1010 | B13: 格里芬 | C13: 2 | D13: 3 | E13: 1 | F13: 2 | G13: 7 | H13: 13 | I13: 8000 | J13: 0 | K13: 0 | L13: 0 | M13: 0 | N13: 格里芬长有狮子的躯体与利爪、鹰的头和翅膀，是相当有名的生物
A14: 1011 | B14: 圣甲虫 | C14: 2 | D14: 1 | E14: 1 | F14: 7 | G14: 4 | H14: 13 | I14: 8000 | J14: 0 | K14: 0 | L14: 0 | M14: 0 | N14: 人们将圣甲虫作为图腾之物，当法老死去时，他的心脏就会被切出来，换上一块缀满圣甲虫的石头。
A15: 1012 | B15: 木乃伊 | C15: 2 | D15: 5 | E15: 2 | F15: 2 | G15: 5 | H15: 14 | I15: 8000 | J15: 0 | K15: 0 | L15: 0 | M15: 0 | N15: 请注意保持对逝者的敬意
A16: 1013 | B16: 蝎子人 | C16: 2 | D16: 2 | E16: 5 | F16: 5 | G16: 2 | H16: 14 | I16: 8000 | J16: 0 | K16: 0 | L16: 0 | M16: 0 | N16: 蝎头人神的怪物，据说当人们死亡的时候，灵魂进入审判堂的时候，他们会趁机偷走遗体
A17: 1014 | B17: 胡狼人 | C17: 2 | D17: 3 | E17: 4 | F17: 5 | G17: 3 | H17: 15 | I17: 8000 | J17: 0 | K17: 0 | L17: 0 | M17: 0 | N17: 法老王的忠实的仆从们，它们永远守护着法老王的遗体
A18: 1015 | B18: 盖亚 | C18: 3 | D18: 3 | E18: 2 | F18: 7 | G18: 6 | H18: 18 | I18: 8000 | J18: 1 | K18: 200 | L18: 1 | M18: 1000 | N18: 希腊神话中的大地之神，是众神之母，所有神灵中德高望重的显赫之神
A19: 1016 | B19: 赫卡忒 | C19: 3 | D19: 2 | E19: 7 | F19: 6 | G19: 3 | H19: 18 | I19: 8000 | J19: 1 | K19: 200 | L19: 1 | M19: 1000 | N19: 赫卡忒总是和月光、夜晚、鬼魂、地狱、精灵、魔法、巫术和妖术联系在一起。之后她曾经帮助宙斯打败过独眼巨人，所以她有着巨人一般的强大力量，即使是宙斯也要畏惧她三分
A20: 1017 | B20: 瑞亚 | C20: 3 | D20: 6 | E20: 3 | F20: 7 | G20: 3 | H20: 19 | I20: 8000 | J20: 1 | K20: 200 | L20: 1 | M20: 1000 | N20: 瑞亚有6个孩子：赫斯提亚、德墨忒尔，赫拉，哈得斯，波塞冬和......宙斯
A21: 1018 | B21: 墨提斯 | C21: 3 | D21: 3 | E21: 6 | F21: 3 | G21: 7 | H21: 19 | I21: 8000 | J21: 1 | K21: 200 | L21: 1 | M21: 1000 | N21: 诞生了雅典娜，墨提斯就成为宙斯的思想和意志
A22: 1019 | B22: 普罗米修斯 | C22: 3 | D22: 5 | E22: 5 | F22: 5 | G22: 5 | H22: 20 | I22: 8000 | J22: 1 | K22: 200 | L22: 1 | M22: 1000 | N22: 盗火者普罗米修斯，他制造了所有的男人，偷了天火，给予人们作为生存下去的必需品...
A23: 1020 | B23: 提尔 | C23: 3 | D23: 6 | E23: 3 | F23: 2 | G23: 7 | H23: 18 | I23: 8000 | J23: 1 | K23: 200 | L23: 1 | M23: 1000 | N23: 只有一只手的战神，他所向披靡，象征着荣耀
A24: 1021 | B24: 洛基 | C24: 3 | D24: 7 | E24: 6 | F24: 2 | G24: 3 | H24: 18 | I24: 8000 | J24: 1 | K24: 200 | L24: 1 | M24: 1000 | N24: 洛基本身是灶火的人格化，火能造福也能为祸
A25: 1022 | B25: 海姆达尔 | C25: 3 | D25: 4 | E25: 5 | F25: 5 | G25: 5 | H25: 19 | I25: 8000 | J25: 1 | K25: 200 | L25: 1 | M25: 1000 | N25: 海姆达尔是神殿的守护者；传说中，人类的三个阶级是海姆达尔创出来的（奴隶，农民，贵族）。他曾化名为里格，并在三个家庭中住宿。
A26: 1023 | B26: 瓦尔基莉亚 | C26: 3 | D26: 5 | E26: 5 | F26: 4 | G26: 5 | H26: 19 | I26: 8000 | J26: 1 | K26: 200 | L26: 1 | M26: 1000 | N26: “身披闪亮的战甲，骑着俊美白马的少女战士们，吹响号角，给英灵们带去蜂蜜酒吧！”--尼伯龙根的回响
A27: 1024 | B27: 诺恩斯/沃德/维尔丹妮 | C27: 3 | D27: 7 | E27: 3 | F27: 3 | G27: 7 | H27: 20 | I27: 8000 | J27: 1 | K27: 200 | L27: 1 | M27: 1000 | N27: 你的命运因何而起，因何而终，我们并不关心，因为我们控制的不是你的命运而是时间
A28: 1025 | B28: 休 | C28: 3 | D28: 2 | E28: 7 | F28: 7 | G28: 2 | H28: 18 | I28: 8000 | J28: 1 | K28: 200 | L28: 1 | M28: 1000 | N28: 古埃及的风神，为了避免天与大地相合，因此休神常常是站在自己的儿子身上，而他的双手则将女儿高高举起，将他们分开。
A29: 1026 | B29: 泰芙努特 | C29: 3 | D29: 7 | E29: 2 | F29: 2 | G29: 7 | H29: 18 | I29: 8000 | J29: 1 | K29: 200 | L29: 1 | M29: 1000 | N29: 控制雨水的神明，当埃及遭遇干旱时，他们就会办成狒狒的样子，让泰芙努特开心，然后亲盆大雨就瓢泼而至了
A30: 1027 | B30: 荷鲁斯 | C30: 3 | D30: 10 | E30: 3 | F30: 3 | G30: 3 | H30: 19 | I30: 8000 | J30: 1 | K30: 200 | L30: 1 | M30: 1000 | N30: 荷鲁斯的眼睛代表的是太阳与月亮，当他没有眼睛的时候，他会不分敌我
A31: 1028 | B31: 凯布利 | C31: 3 | D31: 4 | E31: 5 | F31: 6 | G31: 4 | H31: 19 | I31: 8000 | J31: 1 | K31: 200 | L31: 1 | M31: 1000 | N31: 圣甲虫的神，凯布利经常代替神明指导人类的王应该如何统治与支配
A32: 1029 | B32: 贝斯帝 | C32: 3 | D32: 6 | E32: 2 | F32: 6 | G32: 6 | H32: 20 | I32: 8000 | J32: 1 | K32: 200 | L32: 1 | M32: 1000 | N32: “忠诚？我不过是为了自己的种族罢了，凡人”
A33: 1030 | B33: 尤拉诺斯 | C33: 4 | D33: 7 | E33: 2 | F33: 4 | G33: 8 | H33: 21 | I33: 8000 | J33: 1 | K33: 375 | L33: 1 | M33: 1500 | N33: 象征着天空的神明，但却遭到了儿子的叛变而陨落，所以他也诅咒自己的儿子会和自己拥有相同的因果
A34: 1031 | B34: 尼莫西妮 | C34: 4 | D34: 7 | E34: 1 | F34: 7 | G34: 7 | H34: 22 | I34: 8000 | J34: 1 | K34: 375 | L34: 1 | M34: 1500 | N34: 代表记忆的泰坦神，她是文艺之神缪斯之母，也许她偶尔也会创作一些好作品
A35: 1032 | B35: 考伊斯 | C35: 4 | D35: 5 | E35: 6 | F35: 6 | G35: 6 | H35: 23 | I35: 8000 | J35: 1 | K35: 375 | L35: 1 | M35: 1500 | N35: 也许我的孩子们比我更需要我的宝物也说不定
A36: 1033 | B36: 托尔 | C36: 4 | D36: 8 | E36: 5 | F36: 7 | G36: 3 | H36: 23 | I36: 8000 | J36: 1 | K36: 375 | L36: 1 | M36: 1500 | N36: “我们惧怕闪电是因为害怕之后到达的人，可拍的姆乔尔尼尔”--某位巨人
A37: 1034 | B37: 霍杜尔 | C37: 4 | D37: 3 | E37: 8 | F37: 3 | G37: 8 | H37: 22 | I37: 8000 | J37: 1 | K37: 375 | L37: 1 | M37: 1500 | N37: 我的兄弟，巴尔德唷，黑暗与光明永远都是敌人；霍杜尔天生失明，并且成为了黑暗之神，并在洛基的帮助下杀死了巴尔德
A38: 1035 | B38: 巴尔德 | C38: 4 | D38: 8 | E38: 3 | F38: 8 | G38: 3 | H38: 22 | I38: 8000 | J38: 1 | K38: 375 | L38: 1 | M38: 1500 | N38: 巴尔德才貌出众,满面春风。当他微笑的时候，人们都感到无比喜悦。作为光明之神再恰当不过了。
A39: 1036 | B39: 奥西里斯 | C39: 4 | D39: 6 | E39: 6 | F39: 5 | G39: 6 | H39: 23 | I39: 8000 | J39: 1 | K39: 375 | L39: 1 | M39: 1500 | N39: 奥西里斯是文明的给予者，冥界的审判者，他来审判一切死亡后的人是否能永生
A40: 1037 | B40: 马特 | C40: 4 | D40: 8 | E40: 3 | F40: 3 | G40: 7 | H40: 21 | I40: 8000 | J40: 1 | K40: 375 | L40: 1 | M40: 1500 | N40: 司掌战争的女神，她也是月神的女儿，人们公认的正义的象征，阿努比斯则用它身上的羽毛作为衡量人心是否善良的筹码
A41: 1038 | B41: 阿努比斯 | C41: 4 | D41: 1 | E41: 8 | F41: 8 | G41: 4 | H41: 21 | I41: 8000 | J41: 1 | K41: 375 | L41: 1 | M41: 1500 | N41: 在亡者神殿用天秤决定每个灵魂是上天堂还是下地狱，阿努比斯是奥西里斯的儿子，不过形态却永久处于光明与黑暗之间
A42: 2000 | B42: 克罗诺斯 | C42: 5 | D42: 5 | E42: 9 | F42: 6 | G42: 9 | H42: 29 | I42: 8000 | J42: 1 | K42: 625 | L42: 1 | M42: 2500 | N42: 克洛诺斯推翻了他父亲尤拉诺斯的残暴统治后，领导了希腊神话中的黄金时代，直到他被他自己的儿子宙斯推翻
A43: 2001 | B43: 克瑞斯 | C43: 5 | D43: 1 | E43: 8 | F43: 10 | G43: 8 | H43: 27 | I43: 8000 | J43: 1 | K43: 625 | L43: 1 | M43: 2500 | N43: “你帮助了我找到女儿，你需要点石成金的法术吗？我可以把他祝福在你的手上！”--迈达斯王的回忆
A44: 2002 | B44: 奥丁 | C44: 5 | D44: 4 | E44: 9 | F44: 9 | G44: 7 | H44: 29 | I44: 8000 | J44: 1 | K44: 625 | L44: 1 | M44: 2500 | N44: 北欧神话中的至高神，阿萨神族的神王，天空的人格化，世界的统治者，被称为诸神之父，司掌战争、权力、智慧、魔法和死亡。
A45: 2003 | B45: 赫尔 | C45: 5 | D45: 10 | E45: 1 | F45: 10 | G45: 5 | H45: 26 | I45: 8000 | J45: 1 | K45: 625 | L45: 1 | M45: 2500 | N45: 赫尔的脸一边如神一般温和美丽，而另一边是恶鬼般腐烂狰狞，她的侍者是愚钝，仆从是迟缓，她正式地狱的死神，尼弗海姆的神王
A46: 2004 | B46: 拉 | C46: 5 | D46: 7 | E46: 7 | F46: 7 | G46: 7 | H46: 28 | I46: 8000 | J46: 1 | K46: 625 | L46: 1 | M46: 2500 | N46: 古埃及中拥有绝对权威的太阳神，他高于一切，永远享受着人们的信仰
A47: 2005 | B47: 阿蒙 | C47: 5 | D47: 8 | E47: 8 | F47: 1 | G47: 10 | H47: 27 | I47: 8000 | J47: 1 | K47: 625 | L47: 1 | M47: 2500 | N47: 古代神明的人类代表，阿蒙等同于拉，不同的是，他是以英俊而威严出现，而拉则是以年迈的老人出现
A48: 3000 | B48: 米诺斯战士（牛头怪） | C48: 2 | D48: 4 | E48: 4 | F48: 3 | G48: 2 | H48: 13 | I48: 8000 | J48: 0 | K48: 0 | L48: 0 | M48: 0 | N48: 王国的战士，混沌、邪恶、力量和杀戮的象征；
A49: 3001 | B49: 美杜莎 | C49: 2 | D49: 7 | E49: 2 | F49: 2 | G49: 2 | H49: 13 | I49: 8000 | J49: 0 | K49: 0 | L49: 0 | M49: 0 | N49: 因美丽遭到神明诅咒的雅典娜神庙的普通女祭司，也有传闻她的父亲是海神福耳库斯
A50: 3002 | B50: 九头蛇 | C50: 2 | D50: 5 | E50: 2 | F50: 5 | G50: 2 | H50: 14 | I50: 8000 | J50: 0 | K50: 0 | L50: 0 | M50: 0 | N50: 传说它拥有九颗头，其中一颗头要是被斩断，立刻又会生出两颗头来，真是让人头疼的怪物
A51: 3003 | B51: 半人马 | C51: 2 | D51: 2 | E51: 5 | F51: 2 | G51: 5 | H51: 14 | I51: 8000 | J51: 0 | K51: 0 | L51: 0 | M51: 0 | N51: 希腊人总认为游牧民族都是半人马，但是真相谁知道呢
A52: 3004 | B52: 独眼巨人 | C52: 2 | D52: 4 | E52: 3 | F52: 3 | G52: 5 | H52: 15 | I52: 8000 | J52: 0 | K52: 0 | L52: 0 | M52: 0 | N52: 西里岛的原住民，它们强壮、固执、并且感情冲动，很会制造和使用各种工具和武器
A53: 3005 | B53: 冰霜巨人 | C53: 2 | D53: 2 | E53: 7 | F53: 2 | G53: 2 | H53: 13 | I53: 8000 | J53: 0 | K53: 0 | L53: 0 | M53: 0 | N53: 在约顿海姆生活的蓝色巨人，他们只是热情，并不好战，当然这也是他们自己说的
A54: 3006 | B54: 女武神 | C54: 2 | D54: 1 | E54: 1 | F54: 7 | G54: 4 | H54: 13 | I54: 8000 | J54: 0 | K54: 0 | L54: 0 | M54: 0 | N54: 牵引着灵魂的低阶神明，但是谁知道你会被带到哪儿？
A55: 3007 | B55: 圣灵 | C55: 2 | D55: 5 | E55: 5 | F55: 2 | G55: 2 | H55: 14 | I55: 8000 | J55: 0 | K55: 0 | L55: 0 | M55: 0 | N55: 守护着世界树的圣灵们，他们最擅长的就是点着你或者把你变成冰块
A56: 3008 | B56: 亚尔夫海姆精灵 | C56: 2 | D56: 2 | E56: 2 | F56: 5 | G56: 5 | H56: 14 | I56: 8000 | J56: 0 | K56: 0 | L56: 0 | M56: 0 | N56: “平时看他们种种花草，没想到却会使用这么强大的法术”--托尔
A57: 3009 | B57: 瓦特阿尔海姆侏儒 | C57: 2 | D57: 2 | E57: 4 | F57: 5 | G57: 4 | H57: 15 | I57: 8000 | J57: 0 | K57: 0 | L57: 0 | M57: 0 | N57: 侏儒们都是厉害的巧匠，拥有种种神秘的力量和深遂的知识，他们为神明打造出很多宝物，比如闪电。
A58: 3010 | B58: 格里芬 | C58: 2 | D58: 3 | E58: 1 | F58: 2 | G58: 7 | H58: 13 | I58: 8000 | J58: 0 | K58: 0 | L58: 0 | M58: 0 | N58: 格里芬长有狮子的躯体与利爪、鹰的头和翅膀，是相当有名的生物
A59: 3011 | B59: 圣甲虫 | C59: 2 | D59: 1 | E59: 1 | F59: 7 | G59: 4 | H59: 13 | I59: 8000 | J59: 0 | K59: 0 | L59: 0 | M59: 0 | N59: 人们将圣甲虫作为图腾之物，当法老死去时，他的心脏就会被切出来，换上一块缀满圣甲虫的石头。
A60: 3012 | B60: 木乃伊 | C60: 2 | D60: 5 | E60: 2 | F60: 2 | G60: 5 | H60: 14 | I60: 8000 | J60: 0 | K60: 0 | L60: 0 | M60: 0 | N60: 请注意保持对逝者的敬意
A61: 3013 | B61: 蝎子人 | C61: 2 | D61: 2 | E61: 5 | F61: 5 | G61: 2 | H61: 14 | I61: 8000 | J61: 0 | K61: 0 | L61: 0 | M61: 0 | N61: 蝎头人神的怪物，据说当人们死亡的时候，灵魂进入审判堂的时候，他们会趁机偷走遗体
A62: 3014 | B62: 胡狼人 | C62: 2 | D62: 3 | E62: 4 | F62: 5 | G62: 3 | H62: 15 | I62: 8000 | J62: 0 | K62: 0 | L62: 0 | M62: 0 | N62: 法老王的忠实的仆从们，它们永远守护着法老王的遗体
A63: 3015 | B63: 盖亚 | C63: 3 | D63: 3 | E63: 2 | F63: 7 | G63: 6 | H63: 18 | I63: 8000 | J63: 1 | K63: =R[-45]C*2 -> 400 | L63: 1 | M63: =R[-45]C*2 -> 2000 | N63: 希腊神话中的大地之神，是众神之母，所有神灵中德高望重的显赫之神
A64: 3016 | B64: 赫卡忒 | C64: 3 | D64: 2 | E64: 7 | F64: 6 | G64: 3 | H64: 18 | I64: 8000 | J64: 1 | K64: =R[-45]C*2 -> 400 | L64: 1 | M64: =R[-45]C*2 -> 2000 | N64: 赫卡忒总是和月光、夜晚、鬼魂、地狱、精灵、魔法、巫术和妖术联系在一起。之后她曾经帮助宙斯打败过独眼巨人，所以她有着巨人一般的强大力量，即使是宙斯也要畏惧她三分
A65: 3017 | B65: 瑞亚 | C65: 3 | D65: 6 | E65: 3 | F65: 7 | G65: 3 | H65: 19 | I65: 8000 | J65: 1 | K65: =R[-45]C*2 -> 400 | L65: 1 | M65: =R[-45]C*2 -> 2000 | N65: 瑞亚有6个孩子：赫斯提亚、德墨忒尔，赫拉，哈得斯，波塞冬和......宙斯
A66: 3018 | B66: 墨提斯 | C66: 3 | D66: 3 | E66: 6 | F66: 3 | G66: 7 | H66: 19 | I66: 8000 | J66: 1 | K66: =R[-45]C*2 -> 400 | L66: 1 | M66: =R[-45]C*2 -> 2000 | N66: 诞生了雅典娜，墨提斯就成为宙斯的思想和意志
A67: 3019 | B67: 普罗米修斯 | C67: 3 | D67: 5 | E67: 5 | F67: 5 | G67: 5 | H67: 20 | I67: 8000 | J67: 1 | K67: =R[-45]C*2 -> 400 | L67: 1 | M67: =R[-45]C*2 -> 2000 | N67: 盗火者普罗米修斯，他制造了所有的男人，偷了天火，给予人们作为生存下去的必需品...
A68: 3020 | B68: 提尔 | C68: 3 | D68: 6 | E68: 3 | F68: 2 | G68: 7 | H68: 18 | I68: 8000 | J68: 1 | K68: =R[-45]C*2 -> 400 | L68: 1 | M68: =R[-45]C*2 -> 2000 | N68: 只有一只手的战神，他所向披靡，象征着荣耀
A69: 3021 | B69: 洛基 | C69: 3 | D69: 7 | E69: 6 | F69: 2 | G69: 3 | H69: 18 | I69: 8000 | J69: 1 | K69: =R[-45]C*2 -> 400 | L69: 1 | M69: =R[-45]C*2 -> 2000 | N69: 洛基本身是灶火的人格化，火能造福也能为祸
A70: 3022 | B70: 海姆达尔 | C70: 3 | D70: 4 | E70: 5 | F70: 5 | G70: 5 | H70: 19 | I70: 8000 | J70: 1 | K70: =R[-45]C*2 -> 400 | L70: 1 | M70: =R[-45]C*2 -> 2000 | N70: 海姆达尔是神殿的守护者；传说中，人类的三个阶级是海姆达尔创出来的（奴隶，农民，贵族）。他曾化名为里格，并在三个家庭中住宿。
A71: 3023 | B71: 瓦尔基莉亚 | C71: 3 | D71: 5 | E71: 5 | F71: 4 | G71: 5 | H71: 19 | I71: 8000 | J71: 1 | K71: =R[-45]C*2 -> 400 | L71: 1 | M71: =R[-45]C*2 -> 2000 | N71: “身披闪亮的战甲，骑着俊美白马的少女战士们，吹响号角，给英灵们带去蜂蜜酒吧！”--尼伯龙根的回响
A72: 3024 | B72: 诺恩斯/沃德/维尔丹妮 | C72: 3 | D72: 7 | E72: 3 | F72: 3 | G72: 7 | H72: 20 | I72: 8000 | J72: 1 | K72: =R[-45]C*2 -> 400 | L72: 1 | M72: =R[-45]C*2 -> 2000 | N72: 你的命运因何而起，因何而终，我们并不关心，因为我们控制的不是你的命运而是时间
A73: 3025 | B73: 休 | C73: 3 | D73: 2 | E73: 7 | F73: 7 | G73: 2 | H73: 18 | I73: 8000 | J73: 1 | K73: =R[-45]C*2 -> 400 | L73: 1 | M73: =R[-45]C*2 -> 2000 | N73: 古埃及的风神，为了避免天与大地相合，因此休神常常是站在自己的儿子身上，而他的双手则将女儿高高举起，将他们分开。
A74: 3026 | B74: 泰芙努特 | C74: 3 | D74: 7 | E74: 2 | F74: 2 | G74: 7 | H74: 18 | I74: 8000 | J74: 1 | K74: =R[-45]C*2 -> 400 | L74: 1 | M74: =R[-45]C*2 -> 2000 | N74: 控制雨水的神明，当埃及遭遇干旱时，他们就会办成狒狒的样子，让泰芙努特开心，然后亲盆大雨就瓢泼而至了
A75: 3027 | B75: 荷鲁斯 | C75: 3 | D75: 10 | E75: 3 | F75: 3 | G75: 3 | H75: 19 | I75: 8000 | J75: 1 | K75: =R[-45]C*2 -> 400 | L75: 1 | M75: =R[-45]C*2 -> 2000 | N75: 荷鲁斯的眼睛代表的是太阳与月亮，当他没有眼睛的时候，他会不分敌我
A76: 3028 | B76: 凯布利 | C76: 3 | D76: 4 | E76: 5 | F76: 6 | G76: 4 | H76: 19 | I76: 8000 | J76: 1 | K76: =R[-45]C*2 -> 400 | L76: 1 | M76: =R[-45]C*2 -> 2000 | N76: 圣甲虫的神，凯布利经常代替神明指导人类的王应该如何统治与支配
A77: 3029 | B77: 贝斯帝 | C77: 3 | D77: 6 | E77: 2 | F77: 6 | G77: 6 | H77: 20 | I77: 8000 | J77: 1 | K77: =R[-45]C*2 -> 400 | L77: 1 | M77: =R[-45]C*2 -> 2000 | N77: “忠诚？我不过是为了自己的种族罢了，凡人”
A78: 3030 | B78: 尤拉诺斯 | C78: 4 | D78: 7 | E78: 2 | F78: 4 | G78: 8 | H78: 21 | I78: 8000 | J78: 1 | K78: =R[-45]C*2 -> 750 | L78: 1 | M78: =R[-45]C*2 -> 3000 | N78: 象征着天空的神明，但却遭到了儿子的叛变而陨落，所以他也诅咒自己的儿子会和自己拥有相同的因果
A79: 3031 | B79: 尼莫西妮 | C79: 4 | D79: 7 | E79: 1 | F79: 7 | G79: 7 | H79: 22 | I79: 8000 | J79: 1 | K79: =R[-45]C*2 -> 750 | L79: 1 | M79: =R[-45]C*2 -> 3000 | N79: 代表记忆的泰坦神，她是文艺之神缪斯之母，也许她偶尔也会创作一些好作品
A80: 3032 | B80: 考伊斯 | C80: 4 | D80: 5 | E80: 6 | F80: 6 | G80: 6 | H80: 23 | I80: 8000 | J80: 1 | K80: =R[-45]C*2 -> 750 | L80: 1 | M80: =R[-45]C*2 -> 3000 | N80: 也许我的孩子们比我更需要我的宝物也说不定
A81: 3033 | B81: 托尔 | C81: 4 | D81: 8 | E81: 5 | F81: 7 | G81: 3 | H81: 23 | I81: 8000 | J81: 1 | K81: =R[-45]C*2 -> 750 | L81: 1 | M81: =R[-45]C*2 -> 3000 | N81: “我们惧怕闪电是因为害怕之后到达的人，可拍的姆乔尔尼尔”--某位巨人
A82: 3034 | B82: 霍杜尔 | C82: 4 | D82: 3 | E82: 8 | F82: 3 | G82: 8 | H82: 22 | I82: 8000 | J82: 1 | K82: =R[-45]C*2 -> 750 | L82: 1 | M82: =R[-45]C*2 -> 3000 | N82: 我的兄弟，巴尔德唷，黑暗与光明永远都是敌人；霍杜尔天生失明，并且成为了黑暗之神，并在洛基的帮助下杀死了巴尔德
A83: 3035 | B83: 巴尔德 | C83: 4 | D83: 8 | E83: 3 | F83: 8 | G83: 3 | H83: 22 | I83: 8000 | J83: 1 | K83: =R[-45]C*2 -> 750 | L83: 1 | M83: =R[-45]C*2 -> 3000 | N83: 巴尔德才貌出众,满面春风。当他微笑的时候，人们都感到无比喜悦。作为光明之神再恰当不过了。
A84: 3036 | B84: 奥西里斯 | C84: 4 | D84: 6 | E84: 6 | F84: 5 | G84: 6 | H84: 23 | I84: 8000 | J84: 1 | K84: =R[-45]C*2 -> 750 | L84: 1 | M84: =R[-45]C*2 -> 3000 | N84: 奥西里斯是文明的给予者，冥界的审判者，他来审判一切死亡后的人是否能永生
A85: 3037 | B85: 马特 | C85: 4 | D85: 8 | E85: 3 | F85: 3 | G85: 7 | H85: 21 | I85: 8000 | J85: 1 | K85: =R[-45]C*2 -> 750 | L85: 1 | M85: =R[-45]C*2 -> 3000 | N85: 司掌战争的女神，她也是月神的女儿，人们公认的正义的象征，阿努比斯则用它身上的羽毛作为衡量人心是否善良的筹码
A86: 3038 | B86: 阿努比斯 | C86: 4 | D86: 1 | E86: 8 | F86: 8 | G86: 4 | H86: 21 | I86: 8000 | J86: 1 | K86: =R[-45]C*2 -> 750 | L86: 1 | M86: =R[-45]C*2 -> 3000 | N86: 在亡者神殿用天秤决定每个灵魂是上天堂还是下地狱，阿努比斯是奥西里斯的儿子，不过形态却永久处于光明与黑暗之间
A87: 4000 | B87: 克罗诺斯 | C87: 5 | D87: 5 | E87: 9 | F87: 6 | G87: 9 | H87: 29 | I87: 8000 | J87: 1 | K87: =R[-45]C*2 -> 1250 | L87: 1 | M87: =R[-45]C*2 -> 5000 | N87: 克洛诺斯推翻了他父亲尤拉诺斯的残暴统治后，领导了希腊神话中的黄金时代，直到他被他自己的儿子宙斯推翻
A88: 4001 | B88: 克瑞斯 | C88: 5 | D88: 1 | E88: 8 | F88: 10 | G88: 8 | H88: 27 | I88: 8000 | J88: 1 | K88: =R[-45]C*2 -> 1250 | L88: 1 | M88: =R[-45]C*2 -> 5000 | N88: “你帮助了我找到女儿，你需要点石成金的法术吗？我可以把他祝福在你的手上！”--迈达斯王的回忆
A89: 4002 | B89: 奥丁 | C89: 5 | D89: 4 | E89: 9 | F89: 9 | G89: 7 | H89: 29 | I89: 8000 | J89: 1 | K89: =R[-45]C*2 -> 1250 | L89: 1 | M89: =R[-45]C*2 -> 5000 | N89: 北欧神话中的至高神，阿萨神族的神王，天空的人格化，世界的统治者，被称为诸神之父，司掌战争、权力、智慧、魔法和死亡。
A90: 4003 | B90: 赫尔 | C90: 5 | D90: 10 | E90: 1 | F90: 10 | G90: 5 | H90: 26 | I90: 8000 | J90: 1 | K90: =R[-45]C*2 -> 1250 | L90: 1 | M90: =R[-45]C*2 -> 5000 | N90: 赫尔的脸一边如神一般温和美丽，而另一边是恶鬼般腐烂狰狞，她的侍者是愚钝，仆从是迟缓，她正式地狱的死神，尼弗海姆的神王
A91: 4004 | B91: 拉 | C91: 5 | D91: 7 | E91: 7 | F91: 7 | G91: 7 | H91: 28 | I91: 8000 | J91: 1 | K91: =R[-45]C*2 -> 1250 | L91: 1 | M91: =R[-45]C*2 -> 5000 | N91: 古埃及中拥有绝对权威的太阳神，他高于一切，永远享受着人们的信仰
A92: 4005 | B92: 阿蒙 | C92: 5 | D92: 8 | E92: 8 | F92: 1 | G92: 10 | H92: 27 | I92: 8000 | J92: 1 | K92: =R[-45]C*2 -> 1250 | L92: 1 | M92: =R[-45]C*2 -> 5000 | N92: 古代神明的人类代表，阿蒙等同于拉，不同的是，他是以英俊而威严出现，而拉则是以年迈的老人出现
A96: xl:1
A97: bo:2
A98: aj:3
A99: null:0